{
  "title": "De tijd loopt",
  "warningSeconds": 30,
  "flashEverySeconds": 5,
  "finishedTitle": "Alle lessen zijn voorbij",
  "finishedMessage": "De klok is gestopt.",
  "lessons": [
    {
      "title": "De briefing",
      "start": "2026-09-21T09:00:00+02:00",
      "end": "2026-09-21T09:15:00+02:00"
    },
    {
      "title": "De spannende opdracht",
      "start": "2026-09-21T09:15:00+02:00",
      "end": "2026-09-21T10:00:00+02:00"
    },
    {
      "title": "De ontknoping",
      "start": "2026-09-21T10:05:00+02:00",
      "end": "2026-09-21T10:20:00+02:00"
    }
  ]
}
